"analista de estudios económicos proexpansión es una empresa cuya misión es promover iniciativas de mercado que generen prosperidad empresarial y bienestar ciudadano estamos buscando un analista de estudios económicos para desempeñar las siguientes funciones proyectos de evaluación de impacto de programas sociales proyectos de diseño de reformas de políticas públicas procesamiento y análisis de bases de datos búsqueda y procesamiento de información elaboración de informes y presentaciones sólidos conocimientos de macroeconomía indispensable excel avanzado manejo de bases de datos y paquetes estadísticos spss stata avanzado otros experiencia y aptitud para proyectos de investigación facilidad para analizar datos buena redacción",2014,10,"symplicity","Analista de Estudios Económicos","Proexpansión es una empresa cuya misión es promover iniciativas de mercado que generen prosperidad empresarial y bienestar ciudadano.  Estamos buscando un Analista de Estudios Económicos para desempeñar las siguientes funciones:

+ Proyectos de evaluación de impacto de programas sociales.
+ Proyectos de diseño de reformas de políticas públicas.
+ Procesamiento y análisis de bases de datos.
+ Búsqueda y procesamiento de información.
+ Elaboración de informes y presentaciones.","+ Sólidos conocimientos de macroeconomía
+ Indispensable: Excel Avanzado, manejo de bases de datos y paquetes estadísticos (SPSS, Stata avanzado, otros)
+ Experiencia y aptitud para proyectos de investigación
+ Facilidad para analizar datos
+ Buena redacción","Proexpansión S.R.L. (20506659681)",,,,,,,
"practicante establecimiento de líneas de base monitoreo y evaluación de proyectos análisis económico para proyectos de infraestructura desarrollo regional cadenas productivas aglomeraciones clusters análisis de políticas de competitividad optimización de procesos y mejora de gestión en entidades de apoyo al comercio gobiernos regionales etc análisis de impacto regulatorio en proyectos y iniciativas normativas procesamiento y elaboración de bases de datos estadísticas económicas experiencia requerida mínimo 2 años buena formación en los siguientes temas microeconomía evaluación de proyectos establecimiento de líneas de base monitoreo y evaluación análisis financiero teoría de regulación dominio de métodos de cálculo manejo de base de datos y paquetes econométricos stata e views entre otros en la evaluación no se requerirá experiencia o formación especializada en todas las áreas indicadas anteriormente y se ponderará positivamente en la entrevista las cualidades del candidato estudios de especialización y o maestría en temas afines será un plus",2014,11,"symplicity","Practicante","•	Establecimiento de líneas de base, monitoreo y evaluación de proyectos.
•	Análisis económico para proyectos de infraestructura, desarrollo regional, cadenas productivas, aglomeraciones (clusters).
•	Análisis de políticas de competitividad.
•	Optimización de procesos y mejora de gestión en entidades de apoyo al comercio, gobiernos regionales, etc.
•	Análisis de impacto regulatorio en proyectos y iniciativas normativas.
•	Procesamiento y elaboración de bases de datos estadísticas/económicas.","Experiencia Requerida:
Mínimo 2 años.

Buena formación en los siguientes temas:
•	Microeconomía
•	Evaluación de Proyectos; 
•	Establecimiento de líneas de base, monitoreo y evaluación; 
•	Análisis financiero; 
•	Teoría de regulación; 
•	Dominio de métodos de cálculo, manejo de base de datos y paquetes econométricos (Stata, E-views, entre otros).


En la evaluación no se requerirá experiencia o formación especializada en todas las áreas indicadas anteriormente y se ponderará positivamente en la entrevista las cualidades del candidato. 

Estudios de especialización y/o maestría en temas afines será un plus.","Comercia Consulting S.A.C. (20492292754)",,,,,,,
"analista de costos revisión de los ingresos gastos y costos planificar el direccionamiento de los centros de costos elaboración de análisis económicos financieros de rentabilidad costeo y presupuestos por unidad de negocios responsable de acopiar y procesar información para la elaboración del presupuesto de la organización prestar apoyo en el control de la ejecución presupuestaria llevando registros analizando información responsable de la elaboración de indicadores de gestión apoyo en la elaboración del proyecto del tarifario empresarial experiencia mínima de 2 años manejando presupuestos por centros de negocio y costo experiencia en empresas con grandes volúmenes de productos office nivel avanzado e inglés a nivel intermedio",2014,1,"symplicity","Analista de Costos","-	Revisión de los ingresos, gastos y costos.
-	Planificar el direccionamiento de los centros de costos.
-	Elaboración de análisis económicos financieros de rentabilidad, costeo y presupuestos por unidad de negocios.
-	Responsable de acopiar y procesar información para la elaboración del presupuesto de la organización.
-	Prestar apoyo en el control de la ejecución presupuestaria, llevando registros, analizando información.
-	Responsable de la elaboración de indicadores de gestión.
-	Apoyo en la elaboración del proyecto del tarifario empresarial.","-	Experiencia mínima de 2  años manejando presupuestos por centros de negocio y costo.
-	Experiencia en empresas con grandes volúmenes de productos.
-	Office nivel avanzado e inglés a nivel intermedio.","JML Consultores Gerenciales - Consultora de Recursos Humanos(20508090561)",,"X",,,,,
"practicante de control de gestión apoyar en el análisis financiero y de gestión apoyar en el manejo de indicadores del área otras tareas encomendadas por la jefatura del área conocimiento de ms office a nivel intermedio conocimiento en análisis de información conocimiento del idioma inglés a nivel básico deseable de preferencia experiencia mínima de 03 meses en el área de finanzas",2015,7,"symplicity","Practicante de Control de Gestión","- Apoyar en el análisis financiero y de gestión.
- Apoyar en el manejo de indicadores del área.
- Otras tareas encomendadas por la Jefatura del área
- Conocimiento de MS Office a nivel intermedio.
- Conocimiento en análisis de información.
- Conocimiento del idioma inglés a nivel básico (deseable).
- De preferencia, experiencia mínima de 03 meses en el área de Finanzas.",,"Devanlay Perú SAC (20501977439)",,"X",,,,,
"analista financiero control de gastos liderar la implementación de modelos de planeamiento financiero coordinar elaborar modificación de presupuesto y presentación a las gerencias elaboración de reportes de control de gastos y proyectos estratégicos administración del control y distribución de gastos seguimiento de indicadores clave de la compañía y empresas afiliadas seguimiento de indicadores del mercado de seguros y variables económicas conocimiento en control de gastos conocimiento de indicadores de gestión conocimiento en planeamiento financiero dominio avanzado del excel deseable manejo del sap experiencia mínimo de 2 años de experiencia como analista en control de gestión planeamiento financiero control de gastos",2015,3,"symplicity","Analista Financiero (Control de Gastos)","Liderar la implementación de modelos de planeamiento financiero.
Coordinar, elaborar, modificación de presupuesto y presentación a las Gerencias.
Elaboración de reportes de control de gastos y proyectos estratégicos.
Administración del control y distribución de gastos.
Seguimiento de indicadores clave de la compañía y empresas afiliadas.
Seguimiento de indicadores del mercado de seguros y variables económicas.","Conocimiento en Control de Gastos.
Conocimiento de Indicadores de Gestión.
Conocimiento en Planeamiento Financiero.
Dominio avanzado del Excel.
Deseable manejo del SAP.
Experiencia:
Mínimo de 2 años de experiencia como analista en control de gestión, planeamiento financiero, control de gastos.","La Positiva Vida Seguros y Reaseguros (20454073143)",,"X",,,,,
"analista de dirección de estudios identificación y cuantificación de mercado potencial análisis y seguimiento de la oferta de la competencia evaluación de proyectos experiencia mínima de dos años en áreas de estudios económicos evaluación de proyectos desarrollo de negocios y finanzas conocimiento de análisis financiero de proyectos alta capacidad de análisis de investigación y análisis de información manejo de excel a nivel avanzado dominio del entorno de microsoft office",2014,6,"symplicity","Analista de Dirección de Estudios","Identificación y cuantificación de mercado potencial.
Análisis y seguimiento de la oferta de la competencia.
Evaluación de proyectos.","•	Experiencia mínima de dos años en áreas de estudios económicos, evaluación de proyectos, desarrollo de negocios y finanzas. 
•	Conocimiento de análisis financiero de proyectos.
•	Alta capacidad de análisis de investigación y análisis de información. 
•	Manejo de Excel a nivel Avanzado.
•	Dominio del Entorno de Microsoft Office.","Americatel Perú S.A. (20428698569)",,,,,"X","X",
"analista económico en investigación del cambio climático realizar coordinaciones con instituciones de prestigio cooperantes internacionales gobierno stakeholders y representantes de la sociedad civil búsqueda e investigación bibliográfica sobre economía del cambio climático análisis de los avances y de los entregables de los equipos de investigación a su cargo coordinación con los encargados de los estudios de co beneficios externalidades y condiciones habilitantes con base en política económica atender las consultas y presentar informes a la cooperación internacional como al gobierno que son parte de los proyectos a su cargo análisis de la información macroeconómica y estadística revisión de la información datos avances y resultados proporcionado por los equipos sectoriales preparación de documentos y presentaciones participar y hacer reportes de reuniones multisectoriales realizar tareas técnicas específicas en apoyo a la coordinación del componente de investigación apoyo en el seguimiento y evaluación del componente de investigación con el uso de instrumentos de planificación y monitoreo facilitar las actividades operativas de los equipos sectoriales experiencia en eviews gams etc",2015,2,"symplicity","Analista económico en investigación del cambio climático"," Realizar coordinaciones con instituciones de prestigio, cooperantes internacionales, gobierno,stakeholders y representantes de la sociedad civil.
 Búsqueda e investigación bibliográfica sobre economía del cambio climático.
 Análisis de los avances y de los entregables de los equipos de investigación a su cargo.
 Coordinación con los encargados de los estudios de co-beneficios (externalidades) y condiciones habilitantes con base en política económica. Atender las consultas y presentar informes a la
cooperación internacional como al Gobierno que son parte de los proyectos a su cargo.
 Análisis de la información macroeconómica y estadística.
 Revisión de la información, datos, avances y resultados proporcionado por los equipos sectoriales.
 Preparación de documentos y presentaciones, participar y hacer reportes de reuniones multisectoriales.
 Realizar tareas técnicas específicas en apoyo a la coordinación del componente de Investigación.
 Apoyo en el seguimiento y evaluación del componente de Investigación, con el uso de instrumentos de planificación y monitoreo.
 Facilitar las actividades operativas de los equipos sectoriales.","Experiencia en  EViews, GAMS, etc","Libélula Comunciación, Ambiente y Desarrollo (20516020211)",,,,,"X",,
"practicante apoyar en las investigaciones preliminares y los procedimientos administrativos sancionadores tramitados ante la secretaría técnica apoyar en el procesamiento de base de datos apoyar en la elaboración de ayudas memoria con conocimientos en micro economía estadísticas organización industrial y teoría de la regulación",2017,3,"symplicity","Practicante","Apoyar en las investigaciones preliminares y los procedimientos administrativos sancionadores tramitados ante la Secretaría Técnica.
Apoyar en el procesamiento de base de datos.
Apoyar en la elaboración de ayudas memoria.","Con conocimientos en micro economía, estadísticas, organización industrial y teoría de la Regulación.","Indecopi (20133840533)",,,,"X","X",,
"asistente del área económica análisis económico de presuntas prácticas anticompetitivas barreras comerciales o medidas incompatibles con las reglas de libre comercio análisis económico de la evolución de industrias o empresas específicas análisis de impacto regulatorio de normas evaluación de políticas de competitividad evaluaciones económicas para investigaciones antidumping y antisubvenciones identificación de oportunidades de exportación y aprovechamiento de mercados procesamiento y elaboración de bases de datos estadísticas económicas buena formación en los siguientes temas organización industrial microeconomía economía internacional política comercial tratados comerciales teoría de la regulación dominio de métodos de cálculo manejo de base de datos y paquetes econométricos stata e views entre otros en la evaluación no se requerirá formación especializada en todas las áreas indicadas anteriormente y se ponderará positivamente en la entrevista las cualidades del candidato experiencia 2 años",2014,12,"symplicity","Asistente del área económica","•	Análisis económico de presuntas prácticas anticompetitivas, barreras comerciales o medidas incompatibles con las reglas de libre comercio.
•	Análisis económico de la evolución de industrias o empresas específicas.
•	Análisis de impacto regulatorio de normas.
•	Evaluación de políticas de competitividad.
•	Evaluaciones económicas para investigaciones antidumping y antisubvenciones. 
•	Identificación de oportunidades de exportación y aprovechamiento de mercados.
•	Procesamiento y elaboración de bases de datos estadísticas/económicas.","Buena formación en los siguientes temas:
•	Organización Industrial.
•	Microeconomía.
•	Economía Internacional, Política Comercial, tratados comerciales.
•	Teoría de la Regulación.
•	Dominio de métodos de cálculo, manejo de base de datos y paquetes econométricos (Stata, E-views, entre otros).

En la evaluación no se requerirá formación especializada en todas las áreas indicadas anteriormente y se ponderará positivamente en la entrevista las cualidades del candidato. 
Experiencia 2 años.","Comercia Consulting S.A.C. (20492292754)",,,,"X",,,
"asistente de planeamiento financiero análisis financiero formulación de presupuestos contabilidad evaluación de proyectos de inversión otras funciones asignadas por el jefe inmediato 1 año de experiencia previa muy buen manejo de paquetes informáticos microsoft office y manejo de base de datos para la formulación de reportes deseable conocimiento de sap u erp",2015,3,"symplicity","Asistente de Planeamiento Financiero","Análisis financiero.
Formulación de presupuestos.
Contabilidad .
Evaluación de proyectos de inversión.
Otras funciones asignadas por el jefe inmediato.","1 año de experiencia previa.
Muy buen manejo de paquetes informáticos (Microsoft Office), y manejo de base de datos para la formulación de reportes. 
Deseable conocimiento de SAP u ERP","Fábrica Nacional de Acumuladores Etna S.A. (20100165687)",,"X",,,,,
"practicante de estudios económicos y proyectos especiales actualización de bases de datos económicos elaboración de reportes de análisis económico participación en proyectos de análisis financiero capacidad de análisis capacidad de redacción",2015,8,"symplicity","Practicante de Estudios Económicos y Proyectos Especiales","Actualización de Bases de datos económicos.					
Elaboración de reportes de análisis económico.
Participación en proyectos de análisis financiero.","Capacidad de Análisis.
Capacidad de Redacción.","Telefónica del Perú SAA (20100017491)",,"X",,,,,
"practicante de economía apoyo en los procesos de los proyectos de la dirección general apoyo en la revisión de los proyectos y de los términos de referencia de inversión pública apoyo en el seguimiento de los procesos de adquisición apoyo en otras actividades de la coordinación general sin experiencia",2015,11,"symplicity","Practicante de Economía",". Apoyo en los procesos de los proyectos de la Dirección General.
. Apoyo en la revisión de los proyectos y de los términos de referencia de inversión pública.
. Apoyo en el seguimiento de los procesos de adquisición.
. Apoyo en otras actividades de la Coordinación General.","sin experiencia.","MINISTERIO DE TRANSPORTES Y COMUNICACIONES - MTC (20131379944)",,,,,,"X",
"practicante de estudios económicos procesamiento y análisis de bases de datos búsqueda y procesamiento de información asistencia en la elaboración de informes y presentaciones manejo de bases de datos ms office avanzado experiencia en paquetes estadísticos spss stata avanzado otros aptitud para investigar facilidad para analizar datos buena redacción disponibilidad de 30 horas semanales",2014,3,"symplicity","Practicante de Estudios Económicos","Procesamiento y análisis de bases de datos. 
Búsqueda y procesamiento de información. 
Asistencia en la elaboración de informes y presentaciones.","- Manejo de bases de datos 
- MS Office avanzado.
- Experiencia en paquetes estadísticos (SPSS, Stata avanzado, otros)
- Aptitud para investigar
- Facilidad para analizar datos
- Buena redacción
- Disponibilidad de 30 horas semanales","Proexpansión S.R.L. (20506659681)",,,,,"X",,
"asistente de planeamiento análisis de información financiera análisis de márgenes por producto elaboración del presupuesto anual elaboración y análisis de indicadores de gestión disponibilidad inmediata para trabajar manejo de excell a nivel avanzado manejo de sap a nivel básico intermedio conocimiento de costos de producción",2014,5,"symplicity","Asistente de Planeamiento","-  Análisis de Información Financiera.
-  Análisis de Márgenes por producto.
-  Elaboración del presupuesto anual.
-  Elaboración y análisis de indicadores de gestión.","- Disponibilidad inmediata para trabajar.
- Manejo de Excell a nivel Avanzado.
- Manejo de SAP a nivel básico - intermedio.
- Conocimiento de costos de producción.","PRENSMART S.A.C.. (20100087945)",,,,,,"X",
"practicante de estudios de mercado participación en proyectos de investigación de mercado y estudios económicos procesamiento y análisis de bases de datos búsqueda y procesamiento de información asistencia en la elaboración de informes y presentaciones indispensable excel avanzado spss avanzado stata avanzado otros paquetes estadísticos experiencia y aptitud para proyectos de investigación facilidad para analizar datos buena redacción",2015,7,"symplicity","Practicante de Estudios de Mercado","Participación en proyectos de investigación de mercado y estudios económicos.
Procesamiento y análisis de bases de datos.
Búsqueda y procesamiento de información.
Asistencia en la elaboración de informes y presentaciones.","+ Indispensable: Excel avanzado, SPSS avanzado, Stata avanzado, otros paquetes estadísticos.
+ Experiencia y aptitud para proyectos de investigación.
+ Facilidad para analizar datos.
+ Buena redacción.","Proexpansión S.R.L. (20506659681)",,,,,"X",,"X"
"practicante de sostenibilidad edegel apoyo en la planificación y ejecución del área administrativa del área de sostenibilidad perú apoyo en la elaboración de informes de gestión apoyo en procesos de gestión logística apoyo en el análisis de la materialidad de los grupos de interés apoyo en el análisis de los kpis por cada proyecto apoyo en la evaluación trimestral del status de los proyectos conocimiento microsoft office nivel avanzado e inglés avanzado experiencia deseable en procesos administrativos presupuesto e informes de gestión que sea comunicativo y dinámico",2016,8,"symplicity","Practicante de Sostenibilidad - EDEGEL","Apoyo en la planificación y ejecución del área administrativa del área de Sostenibilidad Perú.
Apoyo en la elaboración de informes de gestión.
Apoyo en procesos de gestión logística.
Apoyo en el análisis de la materialidad de los grupos de interés.
Apoyo en el análisis de los KPIs por cada proyecto.
Apoyo en la evaluación trimestral del status de los proyectos.","Conocimiento: Microsoft Office (Nivel avanzado) e Inglés avanzado.
Experiencia deseable en procesos administrativos, presupuesto e informes de gestión.
Que sea comunicativo y dinámico.","Edelnor S.A.A. (20269985900)",,,,,,"X",
"analista de planeamiento y desarrollo comercial inteligencia comercial mercado automotriz análisis de rentabilidad de nuevos puntos de atención implementacion de proyectos corporativos evaluación de nuevas marcas al grupo elaboración de plan estrategico elaboración de indicadores de seguimiento comercial experiencia de 1 año en puestos de planeamiento marketing comercial finanzas inteligencia comercial conocimientos office a nivel intermedio conocimiento de inglés a nivel avanzado conocimientos de finanzas y evaluación de proyectos deseable conocimiento de excel avanzado manejo de base de datos tablas dinamicas no es necesario macros",2016,12,"symplicity","Analista de Planeamiento y Desarrollo Comercial","•	Inteligencia Comercial Mercado Automotriz.
•	Análisis de rentabilidad de nuevos puntos de atención.
•	Implementacion de proyectos corporativos.
•	Evaluación de nuevas marcas al grupo.
•	Elaboración de Plan Estrategico.
•	Elaboración de indicadores de seguimiento comercial.","Experiencia de 1 año en puestos de Planeamiento, Marketing, Comercial, Finanzas, Inteligencia Comercial.
Conocimientos Office a nivel intermedio.
Conocimiento de inglés a nivel avanzado.
Conocimientos de Finanzas y Evaluación de proyectos deseable.
Conocimiento de Excel avanzado. Manejo de Base de Datos, Tablas Dinamicas. (no es necesario macros).","SKBERGE PERU S.A.C. (20478729791)",,,,,,"X",
"practicante para el programa internacional de erradicación del trabajo infantil de la oit apoyo en elaboración de reportes de investigación sobre trabajo infantil en américa latina asistencia en análisis y procesamiento de información estadística manejo de bases de datos de encuestas de hogares deseable experiencia en manejo de bases de datos",2014,4,"symplicity","Practicante para el Programa Internacional de Erradicación del Trabajo Infantil de la OIT.","Apoyo en elaboración de reportes de investigación sobre trabajo infantil en América Latina.
Asistencia en análisis y procesamiento de información estadística.
Manejo de bases de datos de encuestas de hogares.","Deseable experiencia en manejo de bases de datos.","Organización Internacional del Trabajo (20507781692)",,,,,"X",,
"practicante pre profesional de planeamiento soporte en análisis de mercado investigación de mercado correlación de las unidades de negocio con variables macro económicas apoyo en las funciones del área conocimientos de análisis de estados financieros elaboración de modelos económicos sistema stata deseable",2016,1,"symplicity","Practicante Pre Profesional de Planeamiento","Soporte en análisis de mercado
Investigación de mercado
Correlación de las unidades de negocio con variables macro económicas
Apoyo en las funciones del área","Conocimientos de:
Análisis de Estados Financieros
Elaboración de Modelos Económicos
Sistema STATA (deseable)","Trabajos Maritimos S.A. -  Tramarsa (20101395031)",,,"X",,,,"X"
"analista de control de gestión elaboración de reportes para gerencia e informes gastos por área cumplimiento de ventas y entregas control de proyectos estado de resultados e indicadores de gestión apoyar en la elaboración análisis y seguimiento del presupuesto anual de la empresa envío de información comercial y financiera así como estado de proyectos atención a requerimientos de información interacción con todas las áreas y acopio de información mayor a 3 años en áreas de control de gestión o finanzas en general",2013,6,"symplicity","Analista de Control de Gestión","- Elaboración de reportes para gerencia e informes: gastos por área, cumplimiento de ventas y entregas, control de proyectos, estado de resultados e indicadores de gestión.
- Apoyar en la elaboración, análisis y seguimiento del presupuesto anual de la empresa.
- Envío de información comercial y financiera así como estado de proyectos.
- Atención a requerimientos de información.
- Interacción con todas las áreas y acopio de información.","Mayor a 3 años en áreas de control de gestión o finanzas en general.","ACORN Headhunting & Development (20544030036)",,,,,,"X",
"practicante apoyo en la elaboración de estudios e informes técnicos de precios de transferencia elaboración de análisis económicos búsqueda en base de datos nacionales e internacionales",2013,1,"symplicity","Practicante","Apoyo en la elaboración de Estudios e Informes Técnicos de Precios de Transferencia.
Elaboración de análisis económicos.
Búsqueda en base de datos nacionales e internacionales.",,"BDO CONSULTORES TRIBUTARIOS Y LEGALES S.A. (20158279984)",,"X",,,,,
